<?xml version="1.0" encoding="utf-8" ?>
<Toolbar enabled="true" xmlns:xsi="http://www.w3.org/2001/XMLSchema-instance" xsi:noNamespaceSchemaLocation="..\Xsd\GridToolbar.xsd">
  <Item Text="Show Sidepanel" LabelN="Zijpaneel tonen" LabelF="Montrer le panneau latéral" ImageClass="icon-chevron-expand icon-color-light" NavigateUrl="javascript:#GRID#.ToggleShowSideBar();"/>
  <Item Text="Refresh" ImageClass="icon-refresh" LabelN="Hernieuwen" LabelF="Rafraïchir" NavigateUrl="javascript:#GRID#.Reload();"/>
  <Item isSeparator="true"/>

  <Item Text="Check In" LabelF="Enregistrer" LabelN="Inchecken" ToggleOnMultiSelect="true" ImageClass="icon-document-CHin" NavigateUrl="javascript:#GRID#.DoDocumentListAction(9,0);"/>
  <Item Text="Cancel Check out" LabelF="Annuler la réservation" LabelN="Uitchecken annuleren" ToggleOnMultiSelect="true" ImageClass="icon-document-CHout-cancel" NavigateUrl="javascript:#GRID#.DoDocumentListAction(8,0);"/>

  <Item isSeparator="true"></Item>
  <Item Text="Print" LabelE="Print" LabelN="Afdrukken" LabelF="Imprimer" LabelG="Abdrucken" ImageClass="icon-printer"  NavigateUrl="javascript:#GRID#.PrintGrid();"/>
  <Item Text="Export to Excel" LabelE="Export to Excel" LabelN="Exporteren naar Excel" LabelF="Exporter vers Excel" LabelG="Export to Excel" ImageClass="icon-filetype-excel"  NavigateUrl="javascript:#GRID#.PrintGridToExcel('auto');"/>

  <Item Text="Send by mail" ToggleOnMultiSelect="true" ImageClass="icon-message-mail-attach"  LabelE="Send by e-mail" LabelN="Versturen per mail" LabelF="Envoyer par courriel" LabelG="" NavigateUrl="javascript:#GRID#.MailSelection(4048567);" />
  <Item Text="Download files to ZIP" ToggleOnMultiSelect="true" LabelE="" LabelN="Bestanden downloaden naar ZIP" LabelF="Télécharger les fichiers en ZIP" LabelG="" ImageClass="icon-download-zip" NavigateUrl="javascript:#GRID#.DoDocumentListAction(2,0);"/>
  <Item Text="Download to PDF" ToggleOnMultiSelect="true" LabelE="" LabelN="Downloaden naar PDF" LabelF="Télécharger en PDF" LabelG="" ImageClass="icon-filetype-pdf" NavigateUrl="javascript:#GRID#.DoDocumentListAction(6,0);"/>

  <Item Text="Compare Documents" ToggleOnMultiSelect="true" ImageClass="icon-document-compare" ShowText="false"  LabelE="" LabelN="Documenten vergelijken" LabelF="Comparer les documents" LabelG="" NavigateUrl="Javascript:PC().OpenWindow('./Tools/DocCompare.aspx?docs=' + #GRID#.GetSelection(),'compdocs');" />
  <Item Text="Compare Files" ToggleOnMultiSelect="true" ImageClass="icon-file-compare" ShowText="false" LabelE="" LabelN="Bestanden vergelijken" LabelF="Comparer les fichiers" LabelG="" NavigateUrl="Javascript:PC().OpenWindow('./Tools/FileCompare.aspx?docs=' + #GRID#.GetSelection(),'compfiles');" />
  <Item isCustomActionPlaceHolder="true"></Item>
  <Item isSeparator="true"></Item>
  <Item Text="Copy/Move to Folder" ToggleOnMultiSelect="true"  LabelE="Copy/Move/Shortcut to folder" ImageClass="icon-folder-moveto" LabelN="Kopieren/Verplaatsen/Snelkoppeling naar map" LabelF="Copier/Deplacer/Raccourci vers..." LabelG=""  NavigateUrl="javascript:#GRID#.CopyMoveSelection();" />
  <Item Text="Delete" ToggleOnMultiSelect="true" LabelE="Delete" LabelN="Verwijderen" LabelF="Supprimer" LabelG="Löschen" ImageClass="icon-delete" NavigateUrl="javascript:#GRID#.DoDocumentListAction(4,0);"/>
 
</Toolbar>

